[
  {
    "id": "grade_food_appetite",
    "name": "appetite",
    "kind": "grade",
    "tags": ["food", "warm"],
    "stack": {
      "develop": {"warmth": 0.20, "saturation": 0.14, "vibrance": 0.12, "clarity": 0.10},
      "highlight_bloom": {"intensity": 0.10, "threshold": 0.75}
    },
    "notes": "warm vibrant plates"
  },
  {
    "id": "grade_food_rustic",
    "name": "rustic",
    "kind": "grade",
    "tags": ["food", "earthy"],
    "stack": {
      "develop": {"warmth": 0.15, "contrast": 0.06, "saturation": 0.04},
      "split_tone": {"strength": 0.12, "shadow_rgb": [0.08, 0.05, 0.03], "highlight_rgb": [0.95, 0.88, 0.72]}
    },
    "notes": "earthy browns rustic table"
  },
  {
    "id": "grade_food_fresh_greens",
    "name": "fresh greens",
    "kind": "grade",
    "tags": ["food", "healthy"],
    "stack": {
      "develop": {"vibrance": 0.18, "clarity": 0.12, "warmth": -0.05},
      "multiscale_detail": {"strength": 0.12}
    },
    "notes": "grocery fresh green pop"
  },
  {
    "id": "grade_food_moody_chef",
    "name": "moody chef",
    "kind": "grade",
    "tags": ["food", "dark"],
    "stack": {
      "develop": {"contrast": 0.14, "shadow_lift": 0.05, "vignette": 0.10},
      "split_tone": {"strength": 0.14, "shadow_rgb": [0.02, 0.04, 0.08]},
      "vignette": {"strength": 0.18, "feather": 0.70}
    },
    "notes": "dark restaurant mood"
  },
  {
    "id": "grade_food_pastel_bakery",
    "name": "pastel bakery",
    "kind": "grade",
    "tags": ["food", "pastel"],
    "stack": {
      "develop": {"contrast": -0.03, "vibrance": 0.08, "shadow_lift": 0.08},
      "soft_haze": {"lift": 0.04, "desaturate": 0.08, "warmth": 0.06}
    },
    "notes": "soft bakery pastels"
  },
  {
    "id": "grade_food_street_night",
    "name": "street night",
    "kind": "grade",
    "tags": ["food", "street", "neon"],
    "stack": {
      "develop": {"contrast": 0.10, "saturation": 0.10, "clarity": 0.08},
      "split_tone": {"strength": 0.12, "shadow_rgb": [0.04, 0.02, 0.10], "highlight_rgb": [1.0, 0.82, 0.55]},
      "channel_offset_fringe": {"strength": 0.06, "red_offset": [1, 1], "blue_offset": [-1, -1]}
    },
    "notes": "neon food stall night"
  }
]
