[
  {
    "id": "sig_porcelain_skin",
    "name": "porcelain",
    "kind": "signature",
    "tags": ["portrait", "beauty"],
    "skin_protect": true,
    "stack": {
      "soft_haze": {"lift": 0.03, "desaturate": 0.08, "warmth": -0.04},
      "multiscale_detail": {"strength": 0.08},
      "split_tone": {"strength": 0.10, "shadow_rgb": [0.04, 0.05, 0.10], "highlight_rgb": [0.98, 0.96, 0.94]},
      "orton_glow": {"opacity": 0.22, "blur_sigma": 18}
    },
    "notes": "high-end beauty porcelain finish"
  },
  {
    "id": "sig_cinema_fog",
    "name": "cinema fog",
    "kind": "signature",
    "tags": ["cinema", "atmosphere"],
    "stack": {
      "soft_haze": {"lift": 0.06, "desaturate": 0.14, "warmth": -0.02},
      "split_tone": {"strength": 0.12, "shadow_rgb": [0.02, 0.05, 0.10]},
      "vignette": {"strength": 0.18, "feather": 0.78}
    },
    "notes": "atmospheric depth with cool air"
  },
  {
    "id": "sig_ember_glow",
    "name": "ember glow",
    "kind": "signature",
    "tags": ["warm", "glow", "moody"],
    "stack": {
      "split_tone": {"strength": 0.16, "shadow_rgb": [0.12, 0.04, 0.02], "highlight_rgb": [1.0, 0.65, 0.25]},
      "highlight_bloom": {"intensity": 0.30, "threshold": 0.55},
      "floating_light_gradient": {"intensity": 0.20, "warmth": 0.22, "angle_deg": 20}
    },
    "notes": "fireplace warmth from dark hotspots"
  }
]
