[
  {
    "id": "grade_cine_teal_orange",
    "name": "teal orange",
    "kind": "grade",
    "tags": ["cinema", "portrait"],
    "skin_protect": true,
    "stack": {
      "develop": {"contrast": 0.08, "vibrance": 0.06},
      "split_tone": {"strength": 0.18, "shadow_rgb": [0.02, 0.08, 0.12], "highlight_rgb": [1.0, 0.82, 0.55], "balance": -0.05}
    },
    "notes": "blockbuster teal orange skin-safe"
  },
  {
    "id": "grade_cine_bleach",
    "name": "bleach",
    "kind": "grade",
    "tags": ["cinema", "action"],
    "stack": {
      "develop": {"saturation": -0.30, "contrast": 0.18, "clarity": 0.12},
      "split_tone": {"strength": 0.10, "shadow_rgb": [0.05, 0.05, 0.05]}
    },
    "notes": "action desat bleach cine"
  },
  {
    "id": "grade_cine_pastel",
    "name": "pastel cine",
    "kind": "grade",
    "tags": ["cinema", "pastel"],
    "stack": {
      "develop": {"contrast": -0.03, "vibrance": 0.06, "shadow_lift": 0.06},
      "soft_haze": {"lift": 0.03, "desaturate": 0.08, "warmth": 0.04}
    },
    "notes": "soft contrast pastel cinema"
  },
  {
    "id": "grade_cine_noir",
    "name": "noir",
    "kind": "grade",
    "tags": ["cinema", "dark"],
    "stack": {
      "develop": {"contrast": 0.16, "saturation": -0.40, "vignette": 0.12},
      "split_tone": {"strength": 0.16, "shadow_rgb": [0.02, 0.02, 0.06]},
      "vignette": {"strength": 0.24, "feather": 0.65}
    },
    "notes": "crushed smoky noir"
  },
  {
    "id": "grade_still_product",
    "name": "product clean",
    "kind": "grade",
    "tags": ["still", "product", "clean"],
    "stack": {
      "develop": {"contrast": 0.06, "clarity": 0.10, "highlight_recovery": 0.10},
      "multiscale_detail": {"strength": 0.08}
    },
    "notes": "ecommerce clean product"
  },
  {
    "id": "grade_still_vintage",
    "name": "vintage",
    "kind": "grade",
    "tags": ["still", "vintage"],
    "stack": {
      "develop": {"warmth": 0.12, "contrast": -0.02, "saturation": -0.06},
      "split_tone": {"strength": 0.12, "shadow_rgb": [0.08, 0.06, 0.04], "highlight_rgb": [0.95, 0.90, 0.78]},
      "film_grain": {"amount": 0.06, "size": 1.3, "seed": 33}
    },
    "notes": "sepia-lean vintage still"
  },
  {
    "id": "grade_still_hdr_subtle",
    "name": "hdr subtle",
    "kind": "grade",
    "tags": ["still", "hdr"],
    "stack": {
      "develop": {"shadow_lift": 0.10, "highlight_recovery": 0.14, "clarity": 0.08},
      "multiscale_detail": {"strength": 0.10}
    },
    "notes": "mild local tone map still"
  }
]
